{
  "id": "plan:standalone-showcase",
  "name": "standaloneShowcase",
  "title": "独立演示方案",
  "source": "hybrid",
  "status": "enabled",
  "description": "不依赖基座壳的最小独立交付演示方案。",
  "homePageId": "page:demo-dashboard",
  "menus": [
    {
      "id": "demoSolution",
      "name": "demoSolution",
      "title": "演示方案",
      "route": "/demo",
      "iconName": "icon-menu2level",
      "description": "",
      "meta": {
        "iconName": "icon-menu2level",
        "title": "演示方案",
        "description": ""
      },
      "children": [
        {
          "id": "demoDashboard",
          "name": "demoDashboard",
          "title": "演示看板",
          "route": "/demo/dashboard",
          "iconName": "icon-menu2level",
          "pageId": "page:demo-dashboard",
          "description": "",
          "meta": {
            "iconName": "icon-menu2level",
            "title": "演示看板",
            "description": ""
          },
          "children": []
        },
        {
          "id": "demoWorkspace",
          "name": "demoWorkspace",
          "title": "演示工作区",
          "route": "/demo/workspace",
          "iconName": "icon-menu2level",
          "pageId": "page:demo-workspace",
          "description": "",
          "meta": {
            "iconName": "icon-menu2level",
            "title": "演示工作区",
            "description": ""
          },
          "children": []
        }
      ]
    }
  ]
}
